{
  "schemaVersion": "1.0.0",
  "clock": {
    "hourCycle": "h12",
    "showSeconds": true,
    "showDate": true,
    "analogSweep": "smooth"
  },
  "locale": {
    "policy": "device",
    "tag": null
  },
  "timeZone": {
    "policy": "device",
    "id": null
  },
  "burnIn": {
    "shiftEnabled": false,
    "shiftRadiusPx": 0,
    "shiftIntervalSeconds": 60
  },
  "runtime": {
    "bootStart": true,
    "keepScreenOn": true,
    "safeRefresh": true
  }
}
